{
    "$schema": "http://json-schema.org/schema#",
    "id": "http://quantstamp.com/schemas/analyzer.json",
    "version": "0.0.1",
    "type": "object",
    "title": "Audit report",
    "description": "API schema defining the expected output format of an audit report",
    "additionalProperties": false,
    "required": [
        "status"
    ],
    "properties": {
        "timestamp": {
            "type": "integer",
            "description": "The UTC time in which in this report was produced"
        },
        "audit_state": {
            "type": "integer",
            "description": "The AuditState of the report, as defined in QuantstampAuditData",
            "minimum": 0,
            "maximum": 6
        },
        "version": {
            "type": "string",
            "description": "The version of the audit node"
        },
        "contract_uri": {
            "type": "string",
            "description": "The UTC time in which in this report was produced"
        },
        "contract_hash": {
            "type": "string",
            "pattern": "^[A-Fa-f0-9]{64}$",
            "description": "Hash digest (sha256) of the target contract" 
        },
        "compilation_errors": {
            "type": "array",
            "items": {
                "type": "string"
            },
            "description": "The list of compilation errors preventing the code from compiling"
        },
        "compilation_warnings": {
            "type": "array",
            "items": {
                "type": "string"
            },
            "description": "The list of compilation warnings that do not prevent the code from compiling"
        },
        "requestor": {
            "type": "string",
            "pattern": "^(0x)?[A-Fa-f0-9]{40}$",
            "description": "The account address of the party requesting the audit"
        },
        "auditor": {
            "type": "string",
            "pattern": "^(0x)?[A-Fa-f0-9]{40}$",
            "description": "The account address of the party producing the audit"
        },
        "request_id": {
            "type": "integer"
        },
        "status": {
            "type": "string",
            "enum": [
                "success",
                "error"
            ],
            "description": "Status result of whether the audit was successfully produced or not"
        },
        "analyzers_reports": {
            "type": "array",
            "items": {
                "type": "object",
                "required": [
                    "analyzer",
                    "status"
                ],
                "properties": {
                    "start_time": {
                        "type": "integer",
                        "description": "The starting time (epoch) that the analyzer started execution",
                        "minimum": 1                    
                    },
                    "end_time": {
                        "type": "integer",
                        "description": "The end time (epoch) that the analyzer ended execution",
                        "minimum": 1                    
                    },
                    "analyzer": {
                        "type":  "object",
                        "description": "Meta data concerning the underlying analyzer",
                        "required": ["name"],
                        "properties": {
                            "name": {
                                "description": "Analyzer's name",
                                "type": "string",
                                "maxLength": 50
                            },
                            "version": {
                                "description": "Analyzer's version",
                                "type": "string",
                                "maxLength": 64
                            },
                            "vulnerabilities_checked": {
                                "type": "object",
                                "patternProperties": {
                                    "^.*$": { 
                                        "type": "object",
                                        "properties": {
                                            "type": {
                                                "type": "string"
                                            }
                                        },
                                        "required": ["type"]
                                    }
                                }                     
                            },
                            "command": {
                                "type": "string",
                                "description": "Command used when executing the analyzer for the given report"
                            }
                        }
                    },
                    "status": {
                        "enum": ["success", "error"],
                        "description": "Status result of whether the analyzer succeeded or not"
                    },
                    "errors": {
                        "array": {
                            "type": "string",
                            "description": "List of errors encountered when producing the report"
                        }
                    },
                    "trace": {
                        "array": {
                            "type": "string",
                            "description": "List of tracing information about the analyzer execution"
                        }
                    },
                    "warnings": {
                        "array": {
                            "type": "string",
                            "description": "List of warnings encountered when producing the report"
                        }
                    },
                    "coverages": {
                        "type": "array",
                        "description": "The coverages in percentage achieved in each contract",
                        "items": {
                            "type": "object",
                            "properties": {
                                "percentage": {
                                    "type": "number",
                                    "description": "The percentage value of bytecode statements covered during the audit",
                                    "minimum": 0,
                                    "maximum": 100
                                },
                                "file": {
                                    "type": "string",
                                    "description": "Audited contract file name",
                                    "maxLength": 1000
                                },
                                "contract": {
                                    "type": "string",
                                    "description": "Audited contract name",
                                    "maxLength": 1000
                                }
                            }
                        }
                    },
                    "potential_vulnerabilities": {
                        "type": "array",
                        "description": "List of potential vulnerabilities found",
                        "items": {
                            "title": "Vulnerability",
                            "description": "Descriptive data about each reported vulnerability",
                            "required": [
                                "type",
                                "file",
                                "instances"
                            ],
                            "properties": {
                                "type": {
                                    "type": "string",
                                    "description": "The type of the vulnerability reported by the analyzer",
                                    "maxLength": 1000
                                },                                
                                "file": {
                                    "type": "string",
                                    "description": "Audited contract file name",
                                    "maxLength": 1000
                                },
                                "contract": {
                                    "type": "string",
                                    "description": "Audited contract name",
                                    "maxLength": 1000
                                },
                                "instances": {
                                    "type": "array",
                                    "description": "Array of dictionaries describing each potential vulnerability",
                                    "items": {
                                        "required": [
                                            "ref_id",
                                            "start_line"
                                        ],
                                        "properties": {
                                            "ref_id": {
                                                "type": "integer",
                                                "description": "Reference identifier associated with this instance",
                                                "minimum": 0
                                            },
                                            "start_line": {
                                                "type": "integer",
                                                "description": "The initial line where the vulnerability was found",
                                                "minimum": 0
                                            },
                                            "end_line": {
                                                "type": "integer",
                                                "description": "The end line where the vulnerability was found",
                                                "minimum": 0
                                            }
                                        }
                                    }
                                }
                            }
                        }
                    }
                }
            }
        }
    }
}
