{
  "timestamp": 1542045948,
  "contract_uri": "file:///app/tests/helpers/../resources/DAOBug.sol",
  "contract_hash": "b7f55bc69671c5f4fb295fd5acf1375eb7f1363093176f4bec190c39f95c235b",
  "requestor": "0x7E5F4552091A69125d5DfCb7b8C2659029395Bdf",
  "auditor": "0x7E5F4552091A69125d5DfCb7b8C2659029395Bdf",
  "request_id": 1,
  "version": "2.0.0",
  "audit_state": 4,
  "status": "success",
  "analyzers_reports": [
    {
      "status": "success",
      "potential_vulnerabilities": [
        {
          "type": "reentrancy",
          "file": "DAOBug.sol",
          "description": "The contract account state is changed after an external call. Consider that the called contract could re-enter the function before this state change takes place. This can lead to business logic vulnerabilities.",
          "instances": [
            {
              "ref_id": 2,
              "start_line": 29
            }
          ]
        }
      ],
      "analyzer": {
        "name": "mythril",
        "version": "06e27cca39deb074094eb158e2aca1d1f8ad87558a8b0729b64f9dacd8060cd3",
        "vulnerabilities_checked": {
          "Call data forwarded with delegatecall()": {
            "type": "delegate_call_to_untrusted_contract"
          },
          "Dependence on predictable environment variable": {
            "type": "dependence_on_environment_variable"
          },
          "Call to a user-supplied address": {
            "type": "delegate_call_to_untrusted_contract"
          },
          "Use of tx.origin": {
            "type": "tx_origin_usage"
          },
          "Ether send": {
            "type": "unprotected_ether_withdrawal"
          },
          "Exception state": {
            "type": "exception_state"
          },
          "Message call to external contract": {
            "type": "call_to_external_contract"
          },
          "State change after external call": {
            "type": "reentrancy"
          },
          "Integer Overflow": {
            "type": "integer_overflow"
          },
          "Integer Underflow": {
            "type": "integer_underflow"
          },
          "Multiple Calls": {
            "type": "multiple_calls"
          },
          "Unchecked SUICIDE": {
            "type": "unprotected_self_destruct"
          },
          "Transaction order dependence": {
            "type": "transaction_order_dependency"
          },
          "Unchecked CALL return value": {
            "type": "unchecked_call_return_value"
          },
          "Unknown": {
            "type": "other"
          }
        },
        "command": "docker run --rm -v /tmp/.mythril/1356:/shared/ -i qspprotocol/mythril-usolc-0.5.3@sha256:06e27cca39deb074094eb158e2aca1d1f8ad87558a8b0729b64f9dacd8060cd3  -o json -x /shared/DAOBug.sol"
      },
      "start_time": 1542045940,
      "end_time": 1542045946
    },
    {
      "status": "success",
      "potential_vulnerabilities": [
        {
          "type": "transaction_order_dependency",
          "file": "DAOBug.sol",
          "description": "TODReceiver",
          "contract": "SendBalance",
          "instances": [
            {
              "ref_id": 0,
              "start_line": 25
            }
          ]
        }
      ],
      "analyzer": {
        "name": "securify",
        "version": "59cd6b0b9f258fd7b493f63cecc304c4365dd98a46b0accaab5e8248fc87d010",
        "vulnerabilities_checked": {
          "MissingInputValidation": {
            "type": "missing_input_validation"
          },
          "LockedEther": {
            "type": "locked_ether"
          },
          "UnrestrictedWrite": {
            "type": "unprotected_state_manipulation"
          },
          "UnrestrictedEtherFlow": {
            "type": "unprotected_ether_withdrawal"
          },
          "UnhandledException": {
            "type": "exception_state"
          },
          "DAO": {
            "type": "reentrancy"
          },
          "DAOConstantGas": {
            "type": "reentrancy"
          },
          "TODReceiver": {
            "type": "transaction_order_dependency"
          },
          "TODTransfer": {
            "type": "transaction_order_dependency"
          },
          "TODAmount": {
            "type": "transaction_order_dependency"
          },
          "MissingInputValidationTP": {
            "type": "missing_input_validation_true_positive"
          },
          "LockedEtherTP": {
            "type": "locked_ether_true_positive"
          },
          "UnrestrictedWriteTP": {
            "type": "unprotected_state_manipulation_true_positive"
          },
          "UnrestrictedEtherFlowTP": {
            "type": "unprotected_ether_withdrawal_true_positive"
          },
          "UnhandledExceptionTP": {
            "type": "exception_state_true_positive"
          },
          "DAOTP": {
            "type": "reentrancy_true_positive"
          },
          "DAOConstantGasTP": {
            "type": "reentrancy_true_positive"
          },
          "TODReceiverTP": {
            "type": "transaction_order_dependency_true_positive"
          },
          "TODTransferTP": {
            "type": "transaction_order_dependency_true_positive"
          },
          "TODAmountTP": {
            "type": "transaction_order_dependency_true_positive"
          },
          "SecurifyBug": {
            "type": "securify_bug"
          },
          "Unknown": {
            "type": "other"
          }
        },
        "command": "docker run --rm -v /tmp/.securify/1373:/shared/ -i qspprotocol/securify-usolc-0.5.3@sha256:59cd6b0b9f258fd7b493f63cecc304c4365dd98a46b0accaab5e8248fc87d010  -fs /shared/DAOBug.sol"
      },
      "start_time": 1542045940,
      "end_time": 1542045948
    }
  ],
  "compilation_warnings": [
    "DAOBug.sol:26:7: Warning: \"throw\" is deprecated in favour of \"revert()\", \"require()\" and \"assert()\".\n      throw;\n      ^---^\n",
    "DAOBug.sol:16:3: Warning: No visibility specified. Defaulting to \"public\". \n  function getBalance(address u) constant returns (uint) {\n  ^ (Relevant source part starts here and spans across multiple lines).\n",
    "DAOBug.sol:20:3: Warning: No visibility specified. Defaulting to \"public\". \n  function addToBalance() {\n  ^ (Relevant source part starts here and spans across multiple lines).\n",
    "DAOBug.sol:21:33: Warning: \"msg.value\" used in non-payable function. Do you want to add the \"payable\" modifier to this function?\n    userBalances[msg.sender] += msg.value;\n                                ^-------^\n",
    "DAOBug.sol:24:3: Warning: No visibility specified. Defaulting to \"public\". \n  function withdrawBalance() {\n  ^ (Relevant source part starts here and spans across multiple lines).\n"
  ]
}
