{
  "timestamp": 1542045948,
  "contract_uri": "file:///app/tests/helpers/../resources/DAOBug.sol",
  "contract_hash": "b7f55bc69671c5f4fb295fd5acf1375eb7f1363093176f4bec190c39f95c235b",
  "requestor": "0x7E5F4552091A69125d5DfCb7b8C2659029395Bdf",
  "auditor": "0x7E5F4552091A69125d5DfCb7b8C2659029395Bdf",
  "request_id": 1,
  "version": "2.0.1",
  "audit_state": 4,
  "status": "success",
  "analyzers_reports": [
    {
      "status": "success",
      "potential_vulnerabilities": [
        {
          "type": "unprotected_ether_withdrawal",
          "file": "DAOBug.sol",
          "description": "In the function `withdrawBalance()` a non-zero amount of Ether is sent to msg.sender.\nIt seems that this function can be called without restrictions.",
          "instances": [
            {
              "ref_id": 0,
              "start_line": 25
            }
          ]
        },
        {
          "type": "call_to_external_contract",
          "file": "DAOBug.sol",
          "description": "This contract executes a message call to the address of the transaction sender. Generally, it is not recommended to call user-supplied addresses using Solidity's call() construct. Note that attackers might leverage reentrancy attacks to exploit race conditions or manipulate this contract's state.",
          "instances": [
            {
              "ref_id": 1,
              "start_line": 25
            }
          ]
        },
        {
          "type": "reentrancy",
          "file": "DAOBug.sol",
          "description": "The contract account state is changed after an external call. Consider that the called contract could re-enter the function before this state change takes place. This can lead to business logic vulnerabilities.",
          "instances": [
            {
              "ref_id": 2,
              "start_line": 29
            }
          ]
        }
      ],
      "analyzer": {
        "name": "mythril",
        "version": "c6ad3380cc251ed8c6f59a3e21aafbfb5ceb41a487dbb38e5dfb6beddd123913",
        "vulnerabilities_checked": {
          "Call data forwarded with delegatecall()": {
            "type": "delegate_call_to_untrusted_contract"
          },
          "Dependence on predictable environment variable": {
            "type": "dependence_on_environment_variable"
          },
          "Call to a user-supplied address": {
            "type": "delegate_call_to_untrusted_contract"
          },
          "Use of tx.origin": {
            "type": "tx_origin_usage"
          },
          "Ether send": {
            "type": "unprotected_ether_withdrawal"
          },
          "Exception state": {
            "type": "exception_state"
          },
          "Message call to external contract": {
            "type": "call_to_external_contract"
          },
          "State change after external call": {
            "type": "reentrancy"
          },
          "Integer Overflow": {
            "type": "integer_overflow"
          },
          "Integer Underflow": {
            "type": "integer_underflow"
          },
          "Multiple Calls": {
            "type": "multiple_calls"
          },
          "Unchecked SUICIDE": {
            "type": "unprotected_self_destruct"
          },
          "Transaction order dependence": {
            "type": "transaction_order_dependency"
          },
          "Unchecked CALL return value": {
            "type": "unchecked_call_return_value"
          },
          "Unknown": {
            "type": "other"
          }
        },
        "command": "docker run --rm -v /tmp/.mythril/1356:/shared/ -i qspprotocol/mythril-usolc@sha256:c6ad3380cc251ed8c6f59a3e21aafbfb5ceb41a487dbb38e5dfb6beddd123913  -o json -x /shared/DAOBug.sol"
      },
      "start_time": 1542045940,
      "end_time": 1542045946
    }
  ],
  "compilation_warnings": [
    "DAOBug.sol:26:7: Warning: \"throw\" is deprecated in favour of \"revert()\", \"require()\" and \"assert()\".\n      throw;\n      ^---^\n",
    "DAOBug.sol:16:3: Warning: No visibility specified. Defaulting to \"public\". \n  function getBalance(address u) constant returns (uint) {\n  ^ (Relevant source part starts here and spans across multiple lines).\n",
    "DAOBug.sol:20:3: Warning: No visibility specified. Defaulting to \"public\". \n  function addToBalance() {\n  ^ (Relevant source part starts here and spans across multiple lines).\n",
    "DAOBug.sol:21:33: Warning: \"msg.value\" used in non-payable function. Do you want to add the \"payable\" modifier to this function?\n    userBalances[msg.sender] += msg.value;\n                                ^-------^\n",
    "DAOBug.sol:24:3: Warning: No visibility specified. Defaulting to \"public\". \n  function withdrawBalance() {\n  ^ (Relevant source part starts here and spans across multiple lines).\n"
  ]
}
