{
  "timestamp": 1542045974,
  "contract_uri": "file:///app/tests/helpers/../resources/Empty.sol",
  "contract_hash": "e3b0c44298fc1c149afbf4c8996fb92427ae41e4649b934ca495991b7852b855",
  "requestor": "0x7E5F4552091A69125d5DfCb7b8C2659029395Bdf",
  "auditor": "0x7E5F4552091A69125d5DfCb7b8C2659029395Bdf",
  "request_id": 1,
  "version": "2.0.0",
  "audit_state": 5,
  "status": "error",
  "analyzers_reports": [
    {
      "status": "error",
      "errors": [
        "Traceback (most recent call last):\n",
        "  File \"/usr/local/bin/myth\", line 4, in <module>\n",
        "    __import__('pkg_resources').run_script('mythril==0.18.6', 'myth')\n",
        "  File \"/usr/lib/python3/dist-packages/pkg_resources/__init__.py\", line 658, in run_script\n",
        "    self.require(requires)[0].run_script(script_name, ns)\n",
        "  File \"/usr/lib/python3/dist-packages/pkg_resources/__init__.py\", line 1438, in run_script\n",
        "    exec(code, namespace, namespace)\n",
        "  File \"/usr/local/lib/python3.6/dist-packages/mythril-0.18.6-py3.6.egg/EGG-INFO/scripts/myth\", line 9, in <module>\n",
        "    mythril.interfaces.cli.main()\n",
        "  File \"/usr/local/lib/python3.6/dist-packages/mythril-0.18.6-py3.6.egg/mythril/interfaces/cli.py\", line 159, in main\n",
        "    address, _ = mythril.load_from_solidity(args.solidity_file)  # list of files\n",
        "  File \"/usr/local/lib/python3.6/dist-packages/mythril-0.18.6-py3.6.egg/mythril/mythril.py\", line 305, in load_from_solidity\n",
        "    contract = SolidityContract(file, contract_name, solc_args=self.solc_args)\n",
        "  File \"/usr/local/lib/python3.6/dist-packages/mythril-0.18.6-py3.6.egg/mythril/ether/soliditycontract.py\", line 62, in __init__\n",
        "    for key, contract in data['contracts'].items():\n",
        "KeyError: 'contracts'\n"
      ],
      "trace": [
        ">> Wrapper setup finished\n",
        ">> About to execute once script\n",
        ">> Done\n",
        ">> About to execute pre_run script\n",
        "sha256:e7ef40718273b6d400d45669500dd63a7017215aa8c5748fb3ff91faac73ad95: Pulling from qspprotocol/mythril-usolc-0.5.3\n",
        "Digest: sha256:e7ef40718273b6d400d45669500dd63a7017215aa8c5748fb3ff91faac73ad95\n",
        "Status: Image is up to date for qspprotocol/mythril-usolc-0.5.3@sha256:e7ef40718273b6d400d45669500dd63a7017215aa8c5748fb3ff91faac73ad95\n",
        ">> Done\n",
        ">> Copying contract(s) to docker's mounted volume\n",
        ">> Done\n",
        ">> About to invoke mythril\n",
        ">> Done\n"
      ],
      "analyzer": {
        "name": "mythril",
        "version": "e7ef40718273b6d400d45669500dd63a7017215aa8c5748fb3ff91faac73ad95",
        "vulnerabilities_checked": {
          "Call data forwarded with delegatecall()": {
            "type": "delegate_call_to_untrusted_contract"
          },
          "Dependence on predictable environment variable": {
            "type": "dependence_on_environment_variable"
          },
          "Call to a user-supplied address": {
            "type": "delegate_call_to_untrusted_contract"
          },
          "Use of tx.origin": {
            "type": "tx_origin_usage"
          },
          "Ether send": {
            "type": "unprotected_ether_withdrawal"
          },
          "Exception state": {
            "type": "exception_state"
          },
          "Message call to external contract": {
            "type": "call_to_external_contract"
          },
          "State change after external call": {
            "type": "reentrancy"
          },
          "Integer Overflow": {
            "type": "integer_overflow"
          },
          "Integer Underflow": {
            "type": "integer_underflow"
          },
          "Multiple Calls": {
            "type": "multiple_calls"
          },
          "Unchecked SUICIDE": {
            "type": "unprotected_self_destruct"
          },
          "Transaction order dependence": {
            "type": "transaction_order_dependency"
          },
          "Unchecked CALL return value": {
            "type": "unchecked_call_return_value"
          },
          "Unknown": {
            "type": "other"
          }
        },
        "command": "docker run --rm -v /tmp/.mythril/1538:/shared/ -i qspprotocol/mythril-usolc-0.5.3@sha256:e7ef40718273b6d400d45669500dd63a7017215aa8c5748fb3ff91faac73ad95  -o json -x /shared/Empty.sol"
      },
      "start_time": 1542045970,
      "end_time": 1542045973
    },
    {
      "status": "error",
      "errors": [
        "Exception in thread \"main\" java.lang.NullPointerException\n",
        "\tat ch.securify.CompilationHelpers.compileContracts(CompilationHelpers.java:102)\n",
        "\tat ch.securify.Main.processSolidityFile(Main.java:91)\n",
        "\tat ch.securify.Main.main(Main.java:186)\n"
      ],
      "trace": [
        ">> Wrapper setup finished\n",
        ">> About to execute once script\n",
        ">> Done\n",
        ">> About to execute pre_run script\n",
        "sha256:a1fb59473db3e15c7b6deb756d2f1c09d57074db75105ca6eff41a3f28c6eb4e: Pulling from qspprotocol/securify-usolc-0.5.3\n",
        "Digest: sha256:a1fb59473db3e15c7b6deb756d2f1c09d57074db75105ca6eff41a3f28c6eb4e\n",
        "Status: Image is up to date for qspprotocol/securify-usolc-0.5.3@sha256:a1fb59473db3e15c7b6deb756d2f1c09d57074db75105ca6eff41a3f28c6eb4e\n",
        ">> Done\n",
        ">> Copying contract(s) to docker's mounted volume\n",
        ">> Done\n",
        ">> About to invoke securify\n"
      ],
      "analyzer": {
        "name": "securify",
        "version": "a1fb59473db3e15c7b6deb756d2f1c09d57074db75105ca6eff41a3f28c6eb4e",
        "vulnerabilities_checked": {
          "MissingInputValidation": {
            "type": "missing_input_validation"
          },
          "LockedEther": {
            "type": "locked_ether"
          },
          "UnrestrictedWrite": {
            "type": "unprotected_state_manipulation"
          },
          "UnrestrictedEtherFlow": {
            "type": "unprotected_ether_withdrawal"
          },
          "UnhandledException": {
            "type": "exception_state"
          },
          "DAO": {
            "type": "reentrancy"
          },
          "DAOConstantGas": {
            "type": "reentrancy"
          },
          "TODReceiver": {
            "type": "transaction_order_dependency"
          },
          "TODTransfer": {
            "type": "transaction_order_dependency"
          },
          "TODAmount": {
            "type": "transaction_order_dependency"
          },
          "MissingInputValidationTP": {
            "type": "missing_input_validation_true_positive"
          },
          "LockedEtherTP": {
            "type": "locked_ether_true_positive"
          },
          "UnrestrictedWriteTP": {
            "type": "unprotected_state_manipulation_true_positive"
          },
          "UnrestrictedEtherFlowTP": {
            "type": "unprotected_ether_withdrawal_true_positive"
          },
          "UnhandledExceptionTP": {
            "type": "exception_state_true_positive"
          },
          "DAOTP": {
            "type": "reentrancy_true_positive"
          },
          "DAOConstantGasTP": {
            "type": "reentrancy_true_positive"
          },
          "TODReceiverTP": {
            "type": "transaction_order_dependency_true_positive"
          },
          "TODTransferTP": {
            "type": "transaction_order_dependency_true_positive"
          },
          "TODAmountTP": {
            "type": "transaction_order_dependency_true_positive"
          },
          "SecurifyBug": {
            "type": "securify_bug"
          },
          "Unknown": {
            "type": "other"
          }
        },
        "command": "docker run --rm -v /tmp/.securify/1550:/shared/ -i qspprotocol/securify-usolc-0.5.3@sha256:a1fb59473db3e15c7b6deb756d2f1c09d57074db75105ca6eff41a3f28c6eb4e  -fs /shared/Empty.sol"
      },
      "start_time": 1542045970,
      "end_time": 1542045974
    }
  ],
  "compilation_warnings": [
    "Empty.sol:1:1: Warning: Source file does not specify required compiler version!Consider adding \"pragma solidity ^0.4.25;\"\n\n^\n"
  ]
}
