{
  "timestamp": 1535474053,
  "contract_uri": "file:///app/tests/helpers/../resources/BasicToken.sol",
  "contract_hash": "95d939e9830d5c6c2b393851d8e789d041026cd0ddd75764902b8731945f9a96",
  "requestor": "0x7E5F4552091A69125d5DfCb7b8C2659029395Bdf",
  "auditor": "0x7E5F4552091A69125d5DfCb7b8C2659029395Bdf",
  "request_id": 1,
  "version": "2.0.1",
  "audit_state": 5,
  "status": "error",
  "compilation_errors": [
    "BasicToken.sol:11:1: ParserError: Source \"ERC20Basic.sol\" not found: File outside of allowed directories.\nimport \"./ERC20Basic.sol\";\n^------------------------^\n\nBasicToken.sol:12:1: ParserError: Source \"math/SafeMath.sol\" not found: File outside of allowed directories.\nimport \"../../math/SafeMath.sol\";\n^-------------------------------^\n\n        > command: `solc --standard-json`\n        > return code: `0`\n        > stderr:\n        {\"contracts\":{},\"errors\":[{\"component\":\"general\",\"formattedMessage\":\"BasicToken.sol:11:1: ParserError: Source \\\"ERC20Basic.sol\\\" not found: File outside of allowed directories.\\nimport \\\"./ERC20Basic.sol\\\";\\n^------------------------^\\n\",\"message\":\"Source \\\"ERC20Basic.sol\\\" not found: File outside of allowed directories.\",\"severity\":\"error\",\"sourceLocation\":{\"end\":660,\"file\":\"BasicToken.sol\",\"start\":634},\"type\":\"ParserError\"},{\"component\":\"general\",\"formattedMessage\":\"BasicToken.sol:12:1: ParserError: Source \\\"math/SafeMath.sol\\\" not found: File outside of allowed directories.\\nimport \\\"../../math/SafeMath.sol\\\";\\n^-------------------------------^\\n\",\"message\":\"Source \\\"math/SafeMath.sol\\\" not found: File outside of allowed directories.\",\"severity\":\"error\",\"sourceLocation\":{\"end\":694,\"file\":\"BasicToken.sol\",\"start\":661},\"type\":\"ParserError\"}],\"sources\":{}}\n\n        > stdout:"
  ]
}
