{
  "timestamp": 1554850200,
  "contract_uri": "file:///app/tests/helpers/../resources/DappBinWallet.sol",
  "contract_hash": "71d923c4ff8679e431796020145e9eafff445ccefc47041f588a540233f327e0",
  "requestor": "0x7E5F4552091A69125d5DfCb7b8C2659029395Bdf",
  "auditor": "0x7E5F4552091A69125d5DfCb7b8C2659029395Bdf",
  "request_id": 1,
  "version": "2.0.1",
  "audit_state": 5,
  "status": "error",
  "compilation_errors": [
    "DappBinWallet.sol:12:1: ParserError: Expected pragma, import directive or contract/interface/library definition.\n<!DOCTYPE html>\n^\n\n        > command: `solc --standard-json`\n        > return code: `0`\n        > stderr:\n        {\"errors\":[{\"component\":\"general\",\"formattedMessage\":\"DappBinWallet.sol:12:1: ParserError: Expected pragma, import directive or contract/interface/library definition.\\n<!DOCTYPE html>\\n^\\n\",\"message\":\"Expected pragma, import directive or contract/interface/library definition.\",\"severity\":\"error\",\"sourceLocation\":{\"end\":612,\"file\":\"DappBinWallet.sol\",\"start\":611},\"type\":\"ParserError\"}],\"sources\":{}}\n\n        > stdout:"
  ]
}
